{
  "content": {
    "heading": {
      "text": "Trending now",
      "level": "h2",
      "size": "sm-standard"
    }
  },
  "frameStyle": "lifestyle-portrait-sm",
  "framesVisible": 4,
  "frames": [
    {
      "media": {
        "images": {
          "xs": {
            "caption": null,
            "alt": "Mountain campsite illustration.",
            "attribution": null,
            "renditions": {
              "original": {
                "src": "./svg/storybook-landscape.svg",
                "width": 1600,
                "height": 900
              },
              "wide": null,
              "vertical": null
            },
            "imageType": "svg"
          },
          "sm": {
            "caption": null,
            "alt": "Mountain campsite illustration.",
            "attribution": null,
            "renditions": {
              "original": {
                "src": "./svg/storybook-landscape.svg",
                "width": 1600,
                "height": 900
              },
              "wide": null,
              "vertical": null
            },
            "imageType": "svg"
          },
          "md": {
            "caption": null,
            "alt": "Mountain campsite illustration.",
            "attribution": null,
            "renditions": {
              "original": {
                "src": "./svg/storybook-landscape.svg",
                "width": 1600,
                "height": 900
              },
              "wide": null,
              "vertical": null
            },
            "imageType": "svg"
          },
          "lg": {
            "caption": null,
            "alt": "Mountain campsite illustration.",
            "attribution": null,
            "renditions": {
              "original": {
                "src": "./svg/storybook-landscape.svg",
                "width": 1600,
                "height": 900
              },
              "wide": null,
              "vertical": null
            },
            "imageType": "svg"
          }
        },
        "alt": "Mountain campsite illustration.",
        "useResizing": true,
        "renderedSizes": {
          "mobile": "33vw",
          "desktop": "25vw"
        }
      },
      "cta": {
        "target": "/b/vuori/c/all",
        "text": "Vuori"
      }
    },
    {
      "media": {
        "images": {
          "xs": {
            "caption": null,
            "alt": "Mountain campsite illustration.",
            "attribution": null,
            "renditions": {
              "original": {
                "src": "./svg/storybook-landscape.svg",
                "width": 1600,
                "height": 900
              },
              "wide": null,
              "vertical": null
            },
            "imageType": "svg"
          },
          "sm": {
            "caption": null,
            "alt": "Mountain campsite illustration.",
            "attribution": null,
            "renditions": {
              "original": {
                "src": "./svg/storybook-landscape.svg",
                "width": 1600,
                "height": 900
              },
              "wide": null,
              "vertical": null
            },
            "imageType": "svg"
          },
          "md": {
            "caption": null,
            "alt": "Mountain campsite illustration.",
            "attribution": null,
            "renditions": {
              "original": {
                "src": "./svg/storybook-landscape.svg",
                "width": 1600,
                "height": 900
              },
              "wide": null,
              "vertical": null
            },
            "imageType": "svg"
          },
          "lg": {
            "caption": null,
            "alt": "Mountain campsite illustration.",
            "attribution": null,
            "renditions": {
              "original": {
                "src": "./svg/storybook-landscape.svg",
                "width": 1600,
                "height": 900
              },
              "wide": null,
              "vertical": null
            },
            "imageType": "svg"
          }
        },
        "alt": "Mountain campsite illustration.",
        "useResizing": true,
        "renderedSizes": {
          "mobile": "33vw",
          "desktop": "25vw"
        }
      },
      "cta": {
        "target": "/s/gifts-for-him",
        "text": "Father's Day"
      }
    },
    {
      "media": {
        "images": {
          "xs": {
            "caption": null,
            "alt": "Mountain campsite illustration.",
            "attribution": null,
            "renditions": {
              "original": {
                "src": "./svg/storybook-landscape.svg",
                "width": 1600,
                "height": 900
              },
              "wide": null,
              "vertical": null
            },
            "imageType": "svg"
          },
          "sm": {
            "caption": null,
            "alt": "Mountain campsite illustration.",
            "attribution": null,
            "renditions": {
              "original": {
                "src": "./svg/storybook-landscape.svg",
                "width": 1600,
                "height": 900
              },
              "wide": null,
              "vertical": null
            },
            "imageType": "svg"
          },
          "md": {
            "caption": null,
            "alt": "Mountain campsite illustration.",
            "attribution": null,
            "renditions": {
              "original": {
                "src": "./svg/storybook-landscape.svg",
                "width": 1600,
                "height": 900
              },
              "wide": null,
              "vertical": null
            },
            "imageType": "svg"
          },
          "lg": {
            "caption": null,
            "alt": "Mountain campsite illustration.",
            "attribution": null,
            "renditions": {
              "original": {
                "src": "./svg/storybook-landscape.svg",
                "width": 1600,
                "height": 900
              },
              "wide": null,
              "vertical": null
            },
            "imageType": "svg"
          }
        },
        "alt": "Mountain campsite illustration.",
        "useResizing": true,
        "renderedSizes": {
          "mobile": "33vw",
          "desktop": "25vw"
        }
      },
      "cta": {
        "target": "/s/gifts-for-them",
        "text": "Grad gifts"
      }
    },
    {
      "media": {
        "images": {
          "xs": {
            "caption": null,
            "alt": "Mountain campsite illustration.",
            "attribution": null,
            "renditions": {
              "original": {
                "src": "./svg/storybook-landscape.svg",
                "width": 1600,
                "height": 900
              },
              "wide": null,
              "vertical": null
            },
            "imageType": "svg"
          },
          "sm": {
            "caption": null,
            "alt": "Mountain campsite illustration.",
            "attribution": null,
            "renditions": {
              "original": {
                "src": "./svg/storybook-landscape.svg",
                "width": 1600,
                "height": 900
              },
              "wide": null,
              "vertical": null
            },
            "imageType": "svg"
          },
          "md": {
            "caption": null,
            "alt": "Mountain campsite illustration.",
            "attribution": null,
            "renditions": {
              "original": {
                "src": "./svg/storybook-landscape.svg",
                "width": 1600,
                "height": 900
              },
              "wide": null,
              "vertical": null
            },
            "imageType": "svg"
          },
          "lg": {
            "caption": null,
            "alt": "Mountain campsite illustration.",
            "attribution": null,
            "renditions": {
              "original": {
                "src": "./svg/storybook-landscape.svg",
                "width": 1600,
                "height": 900
              },
              "wide": null,
              "vertical": null
            },
            "imageType": "svg"
          }
        },
        "alt": "Mountain campsite illustration.",
        "useResizing": true,
        "renderedSizes": {
          "mobile": "33vw",
          "desktop": "25vw"
        }
      },
      "cta": {
        "target": "/s/outside-with-pride",
        "text": "Pride"
      }
    },
    {
      "media": {
        "images": {
          "xs": {
            "caption": null,
            "alt": "Mountain campsite illustration.",
            "attribution": null,
            "renditions": {
              "original": {
                "src": "./svg/storybook-landscape.svg",
                "width": 1600,
                "height": 900
              },
              "wide": null,
              "vertical": null
            },
            "imageType": "svg"
          },
          "sm": {
            "caption": null,
            "alt": "Mountain campsite illustration.",
            "attribution": null,
            "renditions": {
              "original": {
                "src": "./svg/storybook-landscape.svg",
                "width": 1600,
                "height": 900
              },
              "wide": null,
              "vertical": null
            },
            "imageType": "svg"
          },
          "md": {
            "caption": null,
            "alt": "Mountain campsite illustration.",
            "attribution": null,
            "renditions": {
              "original": {
                "src": "./svg/storybook-landscape.svg",
                "width": 1600,
                "height": 900
              },
              "wide": null,
              "vertical": null
            },
            "imageType": "svg"
          },
          "lg": {